{
  "claimId": "clm-g-03-010",
  "assetId": "G03",
  "version": "0.1.0",
  "statement": "El Pleno conoce las materias enumeradas en el artículo 10 de la Ley Orgánica 2/1979; las Salas conocen los asuntos de justicia constitucional no reservados al Pleno, y una Sala que pretenda apartarse de doctrina constitucional precedente debe someter la cuestión al Pleno.",
  "sourceUrl": "https://www.boe.es/buscar/act.php?id=BOE-A-1979-23709&p=20240802&tn=1",
  "sourceLocation": "artículos 10, 11 y 13",
  "officialPublication": "BOE núm. 239, de 05-10-1979; texto consolidado con última actualización publicada el 02-08-2024",
  "validFrom": "2015-09-24",
  "validTo": null,
  "legislationCutoffAt": "2026-07-30",
  "owner": "equipo-editorial",
  "reviewStatus": "pending",
  "sourceCheckedAt": "2026-07-30",
  "nextReviewAt": "2026-10-30",
  "dependentAssetIds": [
    "G03",
    "content-source/modules/G03/lesson.md",
    "g-03-q003"
  ],
  "provenance": {
    "createdBy": "codex-assisted-editorial-draft",
    "createdAt": "2026-07-30",
    "changeLog": [
      {
        "version": "0.1.0",
        "date": "2026-07-30",
        "changedBy": "codex-assisted-editorial-draft",
        "summary": "Borrador inicial de afirmación normativa trazable."
      }
    ]
  }
}
