{
  "claimId": "clm-g-02-008",
  "assetId": "G02",
  "version": "0.1.0",
  "statement": "El artículo 21 reconoce la reunión pacífica y sin armas sin autorización previa; exige comunicación previa para reuniones en lugares de tránsito público y manifestaciones, que solo pueden prohibirse por razones fundadas de alteración del orden público con peligro para personas o bienes.",
  "sourceUrl": "https://www.boe.es/buscar/act.php?id=BOE-A-1978-31229&p=20260520&tn=1",
  "sourceLocation": "artículo 21, apartados 1 y 2",
  "officialPublication": "BOE núm. 311, de 29-12-1978; texto consolidado con última actualización publicada el 20-05-2026",
  "validFrom": "1978-12-29",
  "validTo": null,
  "legislationCutoffAt": "2026-07-30",
  "owner": "equipo-editorial",
  "reviewStatus": "pending",
  "sourceCheckedAt": "2026-07-30",
  "nextReviewAt": "2026-10-30",
  "dependentAssetIds": [
    "G02",
    "content-source/modules/G02/lesson.md",
    "content-source/modules/G02/review.md",
    "g-02-q008"
  ],
  "provenance": {
    "createdBy": "codex-assisted-editorial-draft",
    "createdAt": "2026-07-30",
    "changeLog": [
      {
        "version": "0.1.0",
        "date": "2026-07-30",
        "changedBy": "codex-assisted-editorial-draft",
        "summary": "Borrador inicial de afirmación normativa trazable."
      }
    ]
  }
}
