{
  "claimId": "clm-ss-03-023",
  "assetId": "MC02",
  "version": "0.1.0",
  "statement": "En situación de pluriactividad deben solicitarse tantas altas y bajas como regímenes en los que la persona se encuentre comprendida.",
  "sourceUrl": "https://www.boe.es/buscar/act.php?id=BOE-A-1996-4447#a41",
  "sourceLocation": "Real Decreto 84/1996, artículo 41.1",
  "officialPublication": "BOE-A-1996-4447; redacción del artículo 41.1 dada por BOE-A-2022-10677, con efectos desde el 02-01-2023",
  "validFrom": "2023-01-02",
  "validTo": null,
  "legislationCutoffAt": "2026-07-30",
  "owner": "equipo-editorial-ss-casolab",
  "reviewStatus": "pending",
  "sourceCheckedAt": "2026-07-30",
  "nextReviewAt": "2026-08-30",
  "dependentAssetIds": [
    "MC02",
    "ss-02-q105"
  ],
  "provenance": {
    "createdBy": "codex-assisted-editorial-draft",
    "createdAt": "2026-07-30",
    "changeLog": [
      {
        "version": "0.1.0",
        "date": "2026-07-30",
        "changedBy": "codex-assisted-editorial-draft",
        "summary": "Borrador inicial de afirmación normativa trazable para MC02; revisión humana pendiente."
      }
    ]
  }
}
