{
  "claimId": "clm-ss-05-019",
  "assetId": "S05",
  "version": "0.1.0",
  "statement": "La Tesorería puede conceder un aplazamiento por dificultades económico-financieras; la concesión, si se cumplen sus condiciones, suspende el procedimiento respecto de la deuda aplazada, pero la mera solicitud no lo suspende y debe resolverse en un máximo de tres meses.",
  "sourceUrl": "https://www.boe.es/buscar/act.php?id=BOE-A-2004-11836#a31",
  "sourceLocation": "Real Decreto 1415/2004, artículos 31.1, 31.3, 35.4 y 35.5",
  "officialPublication": "BOE-A-2004-11836",
  "validFrom": "2026-07-30",
  "validTo": null,
  "legislationCutoffAt": "2026-07-30",
  "owner": "equipo-editorial-ss-casolab",
  "reviewStatus": "pending",
  "sourceCheckedAt": "2026-07-30",
  "nextReviewAt": "2026-09-30",
  "dependentAssetIds": [
    "S05",
    "ss-05-q007"
  ],
  "provenance": {
    "createdBy": "codex-assisted-editorial-draft",
    "createdAt": "2026-07-30",
    "changeLog": [
      {
        "version": "0.1.0",
        "date": "2026-07-30",
        "changedBy": "codex-assisted-editorial-draft",
        "summary": "Borrador inicial de afirmación normativa para S05."
      }
    ]
  }
}

