{
  "claimId": "clm-g-03-001",
  "assetId": "G03",
  "version": "0.1.0",
  "statement": "La Constitución regula el Tribunal Constitucional en el título IX, artículos 159 a 165, y reserva a una ley orgánica su funcionamiento, el estatuto de sus miembros, el procedimiento y las condiciones para el ejercicio de las acciones.",
  "sourceUrl": "https://www.boe.es/buscar/act.php?id=BOE-A-1978-31229&p=20260520&tn=1",
  "sourceLocation": "título IX, artículos 159 a 165, en especial artículo 165",
  "officialPublication": "BOE núm. 311, de 29-12-1978; texto consolidado con última actualización publicada el 20-05-2026",
  "validFrom": "1978-12-29",
  "validTo": null,
  "legislationCutoffAt": "2026-07-30",
  "owner": "equipo-editorial",
  "reviewStatus": "pending",
  "sourceCheckedAt": "2026-07-30",
  "nextReviewAt": "2026-10-30",
  "dependentAssetIds": [
    "G03",
    "content-source/modules/G03/lesson.md",
    "content-source/modules/G03/review.md"
  ],
  "provenance": {
    "createdBy": "codex-assisted-editorial-draft",
    "createdAt": "2026-07-30",
    "changeLog": [
      {
        "version": "0.1.0",
        "date": "2026-07-30",
        "changedBy": "codex-assisted-editorial-draft",
        "summary": "Borrador inicial de afirmación normativa trazable."
      }
    ]
  }
}
