{
  "claimId": "clm-g-05-016",
  "assetId": "G05",
  "version": "0.1.0",
  "statement": "Puede dirigirse al Defensor cualquier persona natural o jurídica con interés legítimo sin que sean impedimento nacionalidad, residencia, minoría de edad, incapacidad, internamiento o sujeción especial; la queja debe estar firmada, razonada e identificada, presentarse en un máximo de un año y se tramita gratuitamente sin abogado ni procurador.",
  "sourceUrl": "https://www.boe.es/buscar/act.php?id=BOE-A-1981-10325&p=20091104&tn=1",
  "sourceLocation": "artículos 10 y 15",
  "officialPublication": "BOE núm. 109, de 07-05-1981; texto consolidado con última actualización publicada el 04-11-2009",
  "validFrom": "1992-03-26",
  "validTo": null,
  "legislationCutoffAt": "2026-07-30",
  "owner": "equipo-editorial",
  "reviewStatus": "pending",
  "sourceCheckedAt": "2026-07-30",
  "nextReviewAt": "2026-08-30",
  "dependentAssetIds": [
    "G05",
    "content-source/modules/G05/lesson.md",
    "content-source/modules/G05/review.md",
    "g-05-q007"
  ],
  "provenance": {
    "createdBy": "codex-assisted-editorial-draft",
    "createdAt": "2026-07-30",
    "changeLog": [
      {
        "version": "0.1.0",
        "date": "2026-07-30",
        "changedBy": "codex-assisted-editorial-draft",
        "summary": "Borrador inicial de afirmación normativa trazable."
      }
    ]
  }
}
