{
  "claimId": "clm-ss-11-019",
  "assetId": "S11",
  "version": "0.1.0",
  "statement": "La prestación a favor de familiares no se reconoce por el mero hecho de convivir con el fallecido.",
  "sourceUrl": "https://www.boe.es/buscar/act.php?id=BOE-A-2015-11724",
  "sourceLocation": "arts. 226 y 229",
  "officialPublication": "TRLGSS",
  "validFrom": "2026-07-30",
  "validTo": null,
  "legislationCutoffAt": "2026-07-30",
  "owner": "equipo-editorial-ss-casolab",
  "reviewStatus": "pending",
  "sourceCheckedAt": "2026-07-30",
  "nextReviewAt": "2026-09-30",
  "dependentAssetIds": [
    "S11",
    "ss-11-q004"
  ],
  "provenance": {
    "createdBy": "codex-assisted-editorial-draft",
    "createdAt": "2026-07-30",
    "changeLog": [
      {
        "version": "0.1.0",
        "date": "2026-07-30",
        "changedBy": "codex-assisted-editorial-draft",
        "summary": "Borrador inicial de S11."
      }
    ]
  }
}
