{
  "claimId": "clm-g-01-007",
  "assetId": "G01",
  "version": "0.1.0",
  "statement": "El artículo 168 se aplica a la revisión total o a la parcial que afecte al título preliminar, a la sección primera del capítulo segundo del título I o al título II; exige dos tercios de cada Cámara, disolución inmediata, intervención de las nuevas Cámaras y referéndum final obligatorio.",
  "sourceUrl": "https://www.boe.es/buscar/act.php?id=BOE-A-1978-31229",
  "sourceLocation": "artículo 168.1-3",
  "officialPublication": "BOE núm. 311, de 29-12-1978; texto consolidado con última actualización publicada el 20-05-2026",
  "validFrom": "1978-12-29",
  "validTo": null,
  "legislationCutoffAt": "2026-07-29",
  "owner": "equipo-editorial",
  "reviewStatus": "pending",
  "sourceCheckedAt": "2026-07-29",
  "nextReviewAt": "2026-10-29",
  "dependentAssetIds": [
    "G01",
    "content-source/modules/G01/lesson.md",
    "content-source/modules/G01/review.md",
    "g-01-q001",
    "g-01-q006",
    "g-01-q007"
  ],
  "provenance": {
    "createdBy": "codex-assisted-editorial-draft",
    "createdAt": "2026-07-29",
    "changeLog": [
      {
        "version": "0.1.0",
        "date": "2026-07-29",
        "changedBy": "codex-assisted-editorial-draft",
        "summary": "Borrador inicial de afirmación normativa trazable."
      }
    ]
  }
}
