{
  "claimId": "clm-ss-01-701",
  "assetId": "SIM01",
  "version": "0.1.0",
  "statement": "Banco de prÃ¡ctica reutilizable antes de la configuraciÃ³n final de Moodle.",
  "sourceUrl": "https://www.boe.es/buscar/act.php?id=BOE-A-2015-11724",
  "sourceLocation": "Configuración editorial del simulacro; cada ítem conserva su propia fuente normativa.",
  "officialPublication": "BOE-A-2015-11724",
  "validFrom": "2026-07-30",
  "validTo": null,
  "legislationCutoffAt": "2026-07-30",
  "owner": "equipo-editorial-ss-casolab",
  "reviewStatus": "pending",
  "sourceCheckedAt": "2026-07-30",
  "reviewedAt": null,
  "nextReviewAt": "2026-08-30",
  "dependentAssetIds": [
    "SIM01",
    "CP01",
    "g-01-q001",
    "g-01-q002",
    "g-02-q001",
    "g-02-q002",
    "g-03-q001",
    "g-03-q002",
    "g-04-q001",
    "g-04-q002",
    "g-05-q001",
    "g-05-q002",
    "g-06-q001",
    "g-06-q002",
    "g-07-q001",
    "g-07-q002",
    "g-08-q001",
    "g-08-q002",
    "g-09-q001",
    "g-09-q002",
    "g-10-q001",
    "g-10-q002",
    "g-11-q001",
    "g-11-q002",
    "g-12-q001",
    "g-12-q002",
    "g-13-q001",
    "g-13-q002",
    "g-14-q001",
    "g-14-q002",
    "g-15-q001",
    "g-15-q002",
    "g-16-q001",
    "g-16-q002",
    "g-17-q001",
    "g-17-q002",
    "g-18-q001",
    "g-18-q002",
    "g-19-q001",
    "g-19-q002",
    "g-20-q001",
    "g-20-q002",
    "g-21-q001",
    "g-21-q002",
    "g-22-q001",
    "g-22-q002",
    "g-23-q001",
    "g-23-q002",
    "ss-01-q001",
    "ss-01-q002",
    "ss-02-q001",
    "ss-02-q002",
    "ss-03-q001",
    "ss-03-q002",
    "ss-04-q001",
    "ss-04-q002",
    "ss-05-q001",
    "ss-05-q002",
    "ss-06-q001",
    "ss-06-q002",
    "ss-07-q001",
    "ss-07-q002",
    "ss-08-q001",
    "ss-08-q002",
    "ss-09-q001",
    "ss-09-q002",
    "ss-10-q001",
    "ss-10-q002",
    "ss-11-q001",
    "ss-11-q002",
    "ss-12-q001",
    "ss-12-q002",
    "ss-13-q001",
    "ss-13-q002",
    "g-01-q003"
  ],
  "provenance": {
    "createdBy": "codex-assisted-simulation-draft",
    "createdAt": "2026-07-30",
    "changeLog": [
      {
        "version": "0.1.0",
        "date": "2026-07-30",
        "changedBy": "codex-assisted-simulation-draft",
        "summary": "Afirmación de configuración de borrador para SIM01."
      }
    ]
  }
}
