{
  "claimId": "clm-ss-08-017",
  "assetId": "S08",
  "version": "0.1.0",
  "statement": "La gran incapacidad requiere que la persona necesite asistencia de otra para los actos más esenciales de la vida.",
  "sourceUrl": "https://www.boe.es/buscar/act.php?id=BOE-A-2015-11724",
  "sourceLocation": "art. 194.6",
  "officialPublication": "TRLGSS",
  "validFrom": "2026-07-30",
  "validTo": null,
  "legislationCutoffAt": "2026-07-30",
  "owner": "equipo-editorial-ss-casolab",
  "reviewStatus": "pending",
  "sourceCheckedAt": "2026-07-30",
  "nextReviewAt": "2026-09-30",
  "dependentAssetIds": [
    "S08"
  ],
  "provenance": {
    "createdBy": "codex-assisted-editorial-draft",
    "createdAt": "2026-07-30",
    "changeLog": [
      {
        "version": "0.1.0",
        "date": "2026-07-30",
        "changedBy": "codex-assisted-editorial-draft",
        "summary": "Borrador inicial de S08."
      }
    ]
  }
}
