{
  "claimId": "clm-ss-04-009",
  "assetId": "S04",
  "version": "0.1.0",
  "statement": "En 2026, el tipo del Régimen General por contingencias comunes es 28,30 por ciento, distribuido en 23,60 por ciento a cargo de la empresa y 4,70 por ciento a cargo de la persona trabajadora; las contingencias profesionales usan la tarifa legal y son de cargo exclusivo empresarial.",
  "sourceUrl": "https://www.boe.es/buscar/act.php?id=BOE-A-2026-7296#a4",
  "sourceLocation": "Orden PJC/297/2026, artículo 4",
  "officialPublication": "BOE-A-2026-7296",
  "validFrom": "2026-01-01",
  "validTo": null,
  "legislationCutoffAt": "2026-07-30",
  "owner": "equipo-editorial-ss-casolab",
  "reviewStatus": "pending",
  "sourceCheckedAt": "2026-07-30",
  "nextReviewAt": "2026-08-30",
  "dependentAssetIds": ["S04", "ss-04-q003"],
  "provenance": {
    "createdBy": "codex-assisted-editorial-draft",
    "createdAt": "2026-07-30",
    "changeLog": [{"version": "0.1.0", "date": "2026-07-30", "changedBy": "codex-assisted-editorial-draft", "summary": "Borrador inicial de parámetro normativo anual para S04."}]
  }
}
